timestamp,url,title,author,rating,ratings_count,genres,description,page
2025-03-18 16:22:37,https://www.goodreads.com/book/show/8520362-the-grand-design,The Grand Design,Stephen Hawking,4.06,"75,785","Science, Nonfiction, Physics","THE FIRST MAJOR WORK IN NEARLY A DECADE BY ONE OF THE WORLD’S GREAT THINKERS—A MARVELOUSLY CONCISE BOOK WITH NEW ANSWERS TO THE ULTIMATE QUESTIONS OF LIFE

When and how did the universe begin? Why are we here? Why is there something rather than nothing? What is the nature of reality? Why are the laws of nature so finely tuned as to allow for the existence of beings like ourselves? And, finally, is the apparent “grand design” of our universe evidence of a benevolent creator who set things in motion—or does science offer another explanation?

The most fundamental questions about the origins of the universe and of life itself, once the province of philosophy, now occupy the territory where scientists, philosophers, and theologians meet—if only to disagree. In their new book, Stephen Hawking and Leonard Mlodinow present the most recent scientific thinking about the mysteries of the universe, in nontechnical language marked by both brilliance and simplicity.

In The Grand Design they explain that according to quantum theory, the cosmos does not have just a single existence or history, but rather that every possible history of the universe exists simultaneously. When applied to the universe as a whole, this idea calls into question the very notion of cause and effect. But the “top-down” approach to cosmology that Hawking and

Mlodinow describe would say that the fact that the past takes no definite form means that we create history by observing it, rather than that history creates us. The authors further explain that we ourselves are the product of quantum fluctuations in the very early universe, and show how quantum theory predicts the “multiverse”—the idea that ours is just one of many universes that appeared spontaneously out of nothing, each with different laws of nature.

Along the way Hawking and Mlodinow question the conventional concept of reality, posing a “model-dependent” theory of reality as the best we can hope to find. And they conclude with a riveting assessment of M-theory, an explanation of the laws governing us and our universe that is currently the only viable candidate for a complete “theory of everything.” If confirmed, they write, it will be the unified theory that Einstein was looking for, and the ultimate triumph of human reason.

A succinct, startling, and lavishly illustrated guide to discoveries that are altering our understanding and threatening some of our most cherished belief systems, The Grand Design is a book that will inform—and provoke—like no other.'",1
2025-03-18 16:22:48,https://www.goodreads.com/book/show/6117055-the-greatest-show-on-earth,The Greatest Show on Earth: The Evidence for Evolution,Richard Dawkins,4.17,"54,979","Science, Nonfiction, Evolution","Charles Darwin, whose 1859 masterpiece ""On the Origin of Species"" shook society to its core, would surely have raised an incredulous eyebrow at the controversy over evolution still raging 150 years later.

""The Greatest Show on Earth"" is a stunning counter-attack on creationists, followers of ""Intelligent Design"" and all those who still question evolution as scientific fact. In this brilliant tour de force, Richard Dawkins pulls together the incontrovertible evidence that underpins it: from living examples of natural selection to clues in the fossil record; from plate tectonics to molecular genetics.

""The Greatest Show on Earth"" comes at a critical time as systematic opposition to the fact of evolution flourishes as never before in many schools worldwide. Dawkins wields a devastating argument against this ignorance whilst sharing with us his palpable love of science and the natural world. Written with elegance, wit and passion, it is hard-hitting, absorbing and totally convincing.",1
2025-03-18 16:22:59,https://www.goodreads.com/book/show/25734172-seven-brief-lessons-on-physics,Seven Brief Lessons on Physics,Carlo Rovelli,3.99,"62,784","Science, Nonfiction, Physics","All the beauty of modern physics in fewer than a hundred pages.

This is a book about the joy of discovery. A playful, entertaining, and mind-bending introduction to modern physics, it's already a major bestseller in Italy and the United Kingdom. Carlo Rovelli offers surprising—and surprisingly easy to grasp—explanations of general relativity, quantum mechanics, elementary particles, gravity, black holes, the complex architecture of the universe, and the role humans play in this weird and wonderful world. He takes us to the frontiers of our knowledge: to the most minute reaches of the fabric of space, back to the origins of the cosmos, and into the workings of our minds. “Here, on the edge of what we know, in contact with the ocean of the unknown, shines the mystery and the beauty of the world,” Rovelli writes. “And it’s breathtaking.”",1
2025-03-18 16:23:18,https://www.goodreads.com/book/show/22435.The_Fabric_of_the_Cosmos,"The Fabric of the Cosmos: Space, Time, and the Texture of Reality",Brian Greene,4.13,"39,560","Science, Nonfiction, Physics",The fabric of the cosmos,1
2025-03-18 16:23:30,https://www.goodreads.com/book/show/31138556-homo-deus,Homo Deus: A History of Tomorrow,Yuval Noah Harari,4.20,"272,140","Nonfiction, History, Science","Yuval Noah Harari, author of the critically-acclaimed New York Times bestseller and international phenomenon Sapiens, returns with an equally original, compelling, and provocative book, turning his focus toward humanity’s future, and our quest to upgrade humans into gods.
Over the past century humankind has managed to do the impossible and rein in famine, plague, and war. This may seem hard to accept, but, as Harari explains in his trademark style—thorough, yet riveting—famine, plague and war have been transformed from incomprehensible and uncontrollable forces of nature into manageable challenges. For the first time ever, more people die from eating too much than from eating too little; more people die from old age than from infectious diseases; and more people commit suicide than are killed by soldiers, terrorists and criminals put together. The average American is a thousand times more likely to die from binging at McDonalds than from being blown up by Al Qaeda.
What then will replace famine, plague, and war at the top of the human agenda? As the self-made gods of planet earth, what destinies will we set ourselves, and which quests will we undertake? Homo Deus explores the projects, dreams and nightmares that will shape the twenty-first century—from overcoming death to creating artificial life. It asks the fundamental questions: Where do we go from here? And how will we protect this fragile world from our own destructive powers? This is the next stage of evolution. This is Homo Deus.
With the same insight and clarity that made Sapiens an international hit and a New York Times bestseller, Harari maps out our future.",1
2025-03-18 16:23:41,https://www.goodreads.com/book/show/40277241-brief-answers-to-the-big-questions,Brief Answers to the Big Questions,Stephen Hawking,4.27,"81,668","Science, Nonfiction, Physics","Stephen Hawking was recognized as one of the greatest minds of our time and a figure of inspiration after defying his ALS diagnosis at age twenty-one. He is known for both his breakthroughs in theoretical physics as well as his ability to make complex concepts accessible for all, and was beloved for his mischievous sense of humor. At the time of his death, Hawking was working on a final project: a book compiling his answers to the ""big"" questions that he was so often posed--questions that ranged beyond his academic field.

Within these pages, he provides his personal views on our biggest challenges as a human race, and where we, as a planet, are heading next. Each section will be introduced by a leading thinker offering his or her own insight into Professor Hawking's contribution to our understanding.",1
2025-03-18 16:23:52,https://www.goodreads.com/book/show/14743.The_God_Delusion,The God Delusion,Richard Dawkins,3.90,"276,468","Nonfiction, Religion, Science","A preeminent scientist - and the world's most prominent atheist - asserts the irrationality of belief in God, and the grievous harm religion has inflicted on society, from the Crusades to 9/11.

With rigor and wit, Dawkins examines God in all his forms, from the sex-obsessed tyrant of the Old Testament, to the more benign (but still illogical) Celestial Watchmaker favored by some Enlightenment thinkers. He eviscerates the major arguments for religion, and demonstrates the supreme improbability of a supreme being. He shows how religion fuels war, foments bigotry, and abuses children, buttressing his points with historical and contemporary evidence.

The God Delusion makes a compelling case that belief in God is not just wrong, but potentially deadly. It also offers exhilarating insight into the advantages of atheism to the individual and society, not the least of which is a clearer, truer appreciation of the universe's wonders than any faith could ever muster.",1
2025-03-18 16:24:05,https://www.goodreads.com/book/show/61539.The_Structure_of_Scientific_Revolutions,The Structure of Scientific Revolutions,Thomas S. Kuhn,4.04,"28,564","Science, Philosophy, Nonfiction","A good book may have the power to change the way we see the world, but a great book actually becomes part of our daily consciousness, pervading our thinking to the point that we take it for granted, and we forget how provocative and challenging its ideas once were—and still are. The Structure of Scientific Revolutions is that kind of book. When it was first published in 1962, it was a landmark event in the history and philosophy of science. Fifty years later, it still has many lessons to teach.

With The Structure of Scientific Revolutions, Kuhn challenged long-standing linear notions of scientific progress, arguing that transformative ideas don’t arise from the day-to-day, gradual process of experimentation and data accumulation but that the revolutions in science, those breakthrough moments that disrupt accepted thinking and offer unanticipated ideas, occur outside of “normal science,” as he called it. Though Kuhn was writing when physics ruled the sciences, his ideas on how scientific revolutions bring order to the anomalies that amass over time in research experiments are still instructive in our biotech age.

This new edition of Kuhn’s essential work in the history of science includes an insightful introduction by Ian Hacking, which clarifies terms popularized by Kuhn, including paradigm and incommensurability, and applies Kuhn’s ideas to the science of today. Usefully keyed to the separate sections of the book, Hacking’s introduction provides important background information as well as a contemporary context.  Newly designed, with an expanded index, this edition will be eagerly welcomed by the next generation of readers seeking to understand the history of our perspectives on science.",1
2025-03-18 16:24:16,https://www.goodreads.com/book/show/27213168-i-contain-multitudes,I Contain Multitudes: The Microbes Within Us and a Grander View of Life,Ed Yong,4.18,"29,273","Science, Nonfiction, Biology","Every animal, whether human, squid, or wasp, is home to millions of bacteria and other microbes. Many people think of microbes as germs to be eradicated, but those that live with us—the microbiome—build our bodies, protect our health, shape our identities, and grant us incredible abilities. In this astonishing book, Ed Yong takes us on a grand tour through our microbial partners, and introduces us to the scientists on the front lines of discovery.

Yong, whose humor is as evident as his erudition, prompts us to look at ourselves and our animal companions in a new light—less as individuals and more as the interconnected, interdependent multitudes we assuredly are. The microbes in our bodies are part of our immune systems and protect us from disease. Those in cows and termites digest the plants they eat. In the deep oceans, mysterious creatures without mouths or guts depend on microbes for all their energy. Bacteria provide squids with invisibility cloaks, help beetles to bring down forests, and allow worms to cause diseases that afflict millions of people.

I Contain Multitudes is the story of these extraordinary partnerships, between the creatures we are familiar with and those we are not. It reveals how we humans are disrupting these partnerships and how we might manipulate them for our own good. It will change both our view of nature and our sense of where we belong in it.",1
2025-03-18 16:24:27,https://www.goodreads.com/book/show/43582376-the-body,The Body: A Guide for Occupants,Bill Bryson,4.32,"92,010","Nonfiction, Science, Health","In the bestselling, prize-winning A Short History of Nearly Everything, Bill Bryson achieved the seemingly impossible by making the science of our world both understandable and entertaining to millions of people around the globe.

Now he turns his attention inwards to explore the human body, how it functions and its remarkable ability to heal itself. Full of extraordinary facts and astonishing stories, The Body: A Guide for Occupants is a brilliant, often very funny attempt to understand the miracle of our physical and neurological make up.

A wonderful successor to A Short History of Nearly Everything, this book will have you marvelling at the form you occupy, and celebrating the genius of your existence, time and time again.",1
2025-03-18 16:24:38,https://www.goodreads.com/book/show/64582.Chaos,Chaos: Making a New Science,James Gleick,4.04,"39,720","Science, Nonfiction, Physics","A work of popular science in the tradition of Stephen Hawking and Carl Sagan, this 20th-anniversary edition of James Gleick’s groundbreaking bestseller Chaos introduces a whole new readership to chaos theory, one of the most significant waves of scientific knowledge in our time. From Edward Lorenz’s discovery of the Butterfly Effect, to Mitchell Feigenbaum’s calculation of a universal constant, to Benoit Mandelbrot’s concept of fractals, which created a new geometry of nature, Gleick’s engaging narrative focuses on the key figures whose genius converged to chart an innovative direction for science. In Chaos, Gleick makes the story of chaos theory not only fascinating but also accessible to beginners, and opens our eyes to a surprising new view of the universe.",1
2025-03-18 16:24:55,https://www.goodreads.com/book/show/9542311-packing-for-mars,Packing for Mars: The Curious Science of Life in the Void,Mary Roach,3.95,"58,910","Nonfiction, Science, Space","“America’s funniest science writer” ( Washington Post ) explores the irresistibly strange universe of life without gravity in this New York Times bestseller. The best-selling author of Stiff and Bonk explores the irresistibly strange universe of space travel and life without gravity. From the Space Shuttle training toilet to a crash test of NASA’s new space capsule, Mary Roach takes us on the surreally entertaining trip into the science of life in space and space on Earth.",1
2025-03-18 16:25:14,https://www.goodreads.com/book/show/24113.G_del_Escher_Bach,"Gödel, Escher, Bach: An Eternal Golden Braid",Douglas R. Hofstadter,4.30,"51,038","Science, Nonfiction, Philosophy","Douglas Hofstadter's book is concerned directly with the nature of “maps” or links between formal systems. However, according to Hofstadter, the formal system that underlies all mental activity transcends the system that supports it. If life can grow out of the formal chemical substrate of the cell, if consciousness can emerge out of a formal system of firing neurons, then so too will computers attain human intelligence. Gödel, Escher, Bach is a wonderful exploration of fascinating ideas at the heart of cognitive science: meaning, reduction, recursion, and much more.",1
2025-03-18 16:25:32,https://www.goodreads.com/book/show/61663.Pale_Blue_Dot,Pale Blue Dot: A Vision of the Human Future in Space,Carl Sagan,4.34,"38,130","Science, Nonfiction, Astronomy","Pulitzer Prize-winning author Carl Sagan traces our exploration of space and suggests that our very survival may depend on the wise use of other worlds. This stirring book reveals how scientific discovery has altered our perception of who we are and where we stand, and challenges us to weigh what we will do with that knowledge. Photos, many in color.",1
2025-03-18 16:25:50,https://www.goodreads.com/book/show/2095.The_Universe_in_a_Nutshell,The Universe in a Nutshell,Stephen Hawking,4.19,"44,113","Science, Nonfiction, Physics","Stephen Hawking’s phenomenal, multimillion-copy bestseller, A Brief History of Time, introduced the ideas of this brilliant theoretical physicist to readers all over the world.

Now, in a major publishing event, Hawking returns with a lavishly illustrated sequel that unravels the mysteries of the major breakthroughs that have occurred in the years since the release of his acclaimed first book.",1
2025-03-18 16:26:02,https://www.goodreads.com/book/show/117047.The_Blind_Watchmaker,The Blind Watchmaker: Why the Evidence of Evolution Reveals a Universe Without Design,Richard Dawkins,4.09,"40,684","Science, Nonfiction, Biology","***30th Anniversary Edition***

Cover note: Each copy of the anniversary edition of The Blind Watchmaker features a unique biomorph. No two covers are exactly alike.

Acclaimed as the most influential work on evolution written in the last hundred years, The Blind Watchmaker offers an inspiring and accessible introduction to one of the most important scientific discoveries of all time. A brilliant and controversial book which demonstrates that evolution by natural selection - the unconscious, automatic, blind yet essentially non-random process discovered by Darwin - is the only answer to the biggest question of all: why do we exist?",1
2025-03-18 16:26:13,https://www.goodreads.com/book/show/28256439-the-hidden-life-of-trees,"The Mysteries of Nature #1
The Hidden Life of Trees: What They Feel, How They Communicate: Discoveries from a Secret World",Peter Wohlleben,4.07,"82,103","Nonfiction, Science, Nature","In The Hidden Life of Trees, Peter Wohlleben shares his deep love of woods and forests and explains the amazing processes of life, death, and regeneration he has observed in the woodland and the amazing scientific processes behind the wonders of which we are blissfully unaware. Much like human families, tree parents live together with their children, communicate with them, and support them as they grow, sharing nutrients with those who are sick or struggling and creating an ecosystem that mitigates the impact of extremes of heat and cold for the whole group. As a result of such interactions, trees in a family or community are protected and can live to be very old. In contrast, solitary trees, like street kids, have a tough time of it and in most cases die much earlier than those in a group.

Drawing on groundbreaking new discoveries, Wohlleben presents the science behind the secret and previously unknown life of trees and their communication abilities; he describes how these discoveries have informed his own practices in the forest around him. As he says, a happy forest is a healthy forest, and he believes that eco-friendly practices not only are economically sustainable but also benefit the health of our planet and the mental and physical health of all who live on Earth.",1
2025-03-18 16:26:25,https://www.goodreads.com/book/show/3272165-bad-science,Bad Science,Ben Goldacre,4.06,"44,050","Science, Nonfiction, Medicine","How do we know if a treatment works, or if something causes cancer? Can the claims of homeopaths ever be as true—or as interesting—as the improbable research into the placebo effect? Who created the MMR hoax? Do journalists understand science? Why do we seek scientific explanations for social, personal and political problems? Are alternative therapists and the pharmaceutical companies really so different, or do they just use the same old tricks to sell different types of pill?

We are obsessed with our health. And yet—from the media's ""world-expert microbiologist"" with a mail-order Ph.D. in his garden shed laboratory, via multiple health scares and miracle cures, to the million-pound trial that Durham Council now denies ever existed—we are constantly bombarded with inaccurate, contradictory and sometimes even misleading information. Until now.

Ben Goldacre masterfully dismantles the dodgy science behind some of the great drug trials, court cases and missed opportunities of our time, but he also goes further: out of the bullshit, he shows us the fascinating story of how we know what we know, and gives us the tools to uncover bad science for ourselves.",1
2025-03-18 16:26:37,https://www.goodreads.com/book/show/31170723-behave,Behave: The Biology of Humans at Our Best and Worst,Robert M. Sapolsky,4.40,"27,830","Science, Nonfiction, Psychology","Why do we do the things we do?

More than a decade in the making, this game-changing book is Robert Sapolsky's genre-shattering attempt to answer that question as fully as perhaps only he could, looking at it from every angle. Sapolsky's storytelling concept is delightful but it also has a powerful intrinsic logic: he starts by looking at the factors that bear on a person's reaction in the precise moment a behavior occurs, and then hops back in time from there, in stages, ultimately ending up at the deep history of our species and its evolutionary legacy.

And so the first category of explanation is the neurobiological one. A behavior occurs—whether an example of humans at our best, worst, or somewhere in between. What went on in a person's brain a second before the behavior happened? Then Sapolsky pulls out to a slightly larger field of vision, a little earlier in time: What sight, sound, or smell caused the nervous system to produce that behavior? And then, what hormones acted hours to days earlier to change how responsive that individual is to the stimuli that triggered the nervous system? By now he has increased our field of vision so that we are thinking about neurobiology and the sensory world of our environment and endocrinology in trying to explain what happened.

Sapolsky keeps going: How was that behavior influenced by structural changes in the nervous system over the preceding months, by that person's adolescence, childhood, fetal life, and then back to his or her genetic makeup? Finally, he expands the view to encompass factors larger than one individual. How did culture shape that individual's group, what ecological factors millennia old formed that culture? And on and on, back to evolutionary factors millions of years old.

The result is one of the most dazzling tours d'horizon of the science of human behavior ever attempted, a majestic synthesis that harvests cutting-edge research across a range of disciplines to provide a subtle and nuanced perspective on why we ultimately do the things we do ... for good and for ill. Sapolsky builds on this understanding to wrestle with some of our deepest and thorniest questions relating to tribalism and xenophobia, hierarchy and competition, morality and free will, and war and peace. Wise, humane, often very funny, Behave is a towering achievement, powerfully humanizing, and downright heroic in its own right.",1
2025-03-18 16:26:48,https://www.goodreads.com/book/show/1168341.Physics_of_the_Impossible,Physics of the Impossible,Michio Kaku,4.10,"40,629","Science, Nonfiction, Physics","A fascinating exploration of the science of the impossible—from death rays and force fields to invisibility cloaks—revealing to what extent such technologies might be achievable decades or millennia into the future.

One hundred years ago, scientists would have said that lasers, televisions, and the atomic bomb were beyond the realm of physical possibility. In Physics of the Impossible, the renowned physicist Michio Kaku explores to what extent the technologies and devices of science fiction that are deemed equally impossible today might well become commonplace in the future.

From teleportation to telekinesis, Kaku uses the world of science fiction to explore the fundamentals—and the limits—of the laws of physics as we know them today. He ranks the impossible technologies by categories—Class I, II, and III, depending on when they might be achieved, within the next century, millennia, or perhaps never. In a compelling and thought-provoking narrative, he explains:
· How the science of optics and electromagnetism may one day enable us to bend light around an object, like a stream flowing around a boulder, making the object invisible to observers “downstream”
· How ramjet rockets, laser sails, antimatter engines, and nanorockets may one day take us to the nearby stars
· How telepathy and psychokinesis, once considered pseudoscience, may one day be possible using advances in MRI, computers, superconductivity, and nanotechnology
· Why a time machine is apparently consistent with the known laws of quantum physics, although it would take an unbelievably advanced civilization to actually build one
Kaku uses his discussion of each technology as a jumping-off point to explain the science behind it. An extraordinary scientific adventure, Physics of the Impossible takes readers on an unforgettable, mesmerizing journey into the world of science that both enlightens and entertains.",1
