timestamp,url,title,author,rating,ratings_count,genres,description,page
2025-03-18 16:27:00,https://www.goodreads.com/book/show/35820369-the-rise-and-fall-of-the-dinosaurs,"The Rise and Fall
The Rise and Fall of the Dinosaurs: A New History of a Lost World",Steve Brusatte,4.21,"36,600","Nonfiction, Science, History","The dinosaurs. Sixty-six million years ago, the Earth’s most fearsome creatures vanished. Today they remain one of our planet’s great mysteries. Now The Rise and Fall of the Dinosaurs reveals their extraordinary, 200-million-year-long story as never before.

In this captivating narrative (enlivened with more than seventy original illustrations and photographs), Steve Brusatte, a young American paleontologist who has emerged as one of the foremost stars of the field—naming fifteen new species and leading groundbreaking scientific studies and fieldwork—masterfully tells the complete, surprising, and new history of the dinosaurs, drawing on cutting-edge science to dramatically bring to life their lost world and illuminate their enigmatic origins, spectacular flourishing, astonishing diversity, cataclysmic extinction, and startling living legacy. Captivating and revelatory, The Rise and Fall of the Dinosaurs is a book for the ages.

Brusatte traces the evolution of dinosaurs from their inauspicious start as small shadow dwellers—themselves the beneficiaries of a mass extinction caused by volcanic eruptions at the beginning of the Triassic period—into the dominant array of species every wide-eyed child memorizes today, T. rex, Triceratops, Brontosaurus, and more. This gifted scientist and writer re-creates the dinosaurs’ peak during the Jurassic and Cretaceous, when thousands of species thrived, and winged and feathered dinosaurs, the prehistoric ancestors of modern birds, emerged. The story continues to the end of the Cretaceous period, when a giant asteroid or comet struck the planet and nearly every dinosaur species (but not all) died out, in the most extraordinary extinction event in earth’s history, one full of lessons for today as we confront a “sixth extinction.”

Brusatte also recalls compelling stories from his globe-trotting expeditions during one of the most exciting eras in dinosaur research—which he calls “a new golden age of discovery”—and offers thrilling accounts of some of the remarkable findings he and his colleagues have made, including primitive human-sized tyrannosaurs; monstrous carnivores even larger than T. rex; and paradigm-shifting feathered raptors from China.

An electrifying scientific history that unearths the dinosaurs’ epic saga, The Rise and Fall of the Dinosaurs will be a definitive and treasured account for decades to come.",1
2025-03-18 16:27:13,https://www.goodreads.com/book/show/52668915-entangled-life,"Entangled Life: How Fungi Make Our Worlds, Change Our Minds & Shape Our Futures",Merlin Sheldrake,4.34,"44,322","Nonfiction, Science, Nature","There is a lifeform so strange and wondrous that it forces us to rethink how life works…

Neither plant nor animal, it is found throughout the earth, the air and our bodies. It can be microscopic, yet also accounts for the largest organisms ever recorded, living for millennia and weighing tens of thousands of tonnes. Its ability to digest rock enabled the first life on land, it can survive unprotected in space, and thrives amidst nuclear radiation.

In this captivating adventure, Merlin Sheldrake explores the spectacular and neglected world of fungi: endlessly surprising organisms that sustain nearly all living systems. They can solve problems without a brain, stretching traditional definitions of ‘intelligence’, and can manipulate animal behaviour with devastating precision. In giving us bread, alcohol and life-saving medicines, fungi have shaped human history, and their psychedelic properties, which have influenced societies since antiquity, have recently been shown to alleviate a number of mental illnesses. The ability of fungi to digest plastic, explosives, pesticides and crude oil is being harnessed in break-through technologies, and the discovery that they connect plants in underground networks, the ‘Wood Wide Web’, is transforming the way we understand ecosystems. Yet they live their lives largely out of sight, and over ninety percent of their species remain undocumented.

Entangled Life is a mind-altering journey into this hidden kingdom of life, and shows that fungi are key to understanding the planet on which we live, and the ways we think, feel and behave. The more we learn about fungi, the less makes sense without them.",1
2025-03-18 16:27:26,https://www.goodreads.com/book/show/20663770-death-by-black-hole,"Death by Black Hole: And Other Cosmic Quandaries
Death by Black Hole: And Other Cosmic Quandaries",Neil deGrasse Tyson,4.10,"31,593","Science, Nonfiction, Physics","A vibrant collection of essays on the cosmos from the nation's best-known astrophysicist. ""One of today's best popularizers of science."" —Kirkus Reviews.

Loyal readers of the monthly ""Universe"" essays in Natural History magazine have long recognized Neil deGrasse Tyson's talent for guiding them through the mysteries of the cosmos with stunning clarity and almost childlike enthusiasm. Here, Tyson compiles his favorite essays across a myriad of cosmic topics.

The title essay introduces readers to the physics of black holes by explaining the gory details of what would happen to your body if you fell into one. ""Holy Wars"" examines the needless friction between science and religion in the context of historical conflicts. ""The Search for Life in the Universe"" explores astral life from the frontiers of astrobiology. And ""Hollywood Nights"" assails the movie industry's feeble efforts to get its night skies right.

Known for his ability to blend content, accessibility, and humor, Tyson is a natural teacher who simplifies some of the most complex concepts in astrophysics while simultaneously sharing his infectious excitement about our universe.",1
2025-03-18 16:27:37,https://www.goodreads.com/book/show/4591.Genome,Genome: The Autobiography of a Species in 23 Chapters,Matt Ridley,4.06,"27,386","Science, Nonfiction, Biology","“Ridley leaps from chromosome to chromosome in a handy summation of our ever increasing understanding of the roles that genes play in disease, behavior, sexual differences, and even intelligence. . . . . He addresses not only the ethical quandaries faced by contemporary scientists but the reductionist danger in equating inheritability with inevitability.” — The New Yorker The genome's been mapped. But what does it mean? Matt Ridley’s Genome is the book that explains it what it is, how it works, and what it portends for the future Arguably the most significant scientific discovery of the new century, the mapping of the twenty-three pairs of chromosomes that make up the human genome raises almost as many questions as it answers. Questions that will profoundly impact the way we think about disease, about longevity, and about free will. Questions that will affect the rest of your life. Genome offers extraordinary insight into the ramifications of this incredible breakthrough. By picking one newly discovered gene from each pair of chromosomes and telling its story, Matt Ridley recounts the history of our species and its ancestors from the dawn of life to the brink of future medicine. From Huntington's disease to cancer, from the applications of gene therapy to the horrors of eugenics, Ridley probes the scientific, philosophical, and moral issues arising as a result of the mapping of the genome. It will help you understand what this scientific milestone means for you, for your children, and for humankind.",1
2025-03-18 16:27:49,https://www.goodreads.com/book/show/36442813-the-order-of-time,The Order of Time,Carlo Rovelli,4.13,"35,251","Science, Nonfiction, Physics","Time is a mystery that does not cease to puzzle us. Philosophers, artists and poets have long explored its meaning while scientists have found that its structure is different from the simple intuition we have of it. From Boltzmann to quantum theory, from Einstein to loop quantum gravity, our understanding of time has been undergoing radical transformations. Time flows at different speeds in different places, the past and the future differ far less than we might think and the very notion of the present evaporates in the vast universe.

With his extraordinary charm and sense of wonder, bringing together science, philosophy and art, Carlo Rovelli unravels this mystery, inviting us to imagine a world where time is in us and we are not in time.",1
2025-03-18 16:28:08,https://www.goodreads.com/book/show/5553.Six_Easy_Pieces,Six Easy Pieces: Essentials of Physics Explained by Its Most Brilliant Teacher,Richard P. Feynman,4.21,"29,493","Science, Physics, Nonfiction","Six Easy Essentials of Physics Explained by Its Most Brilliant Teacher is a publishing first. This set couples a book containing the six easiest chapters from Richard P. Feynman's landmark work, Lectures on Physics —specifically designed for the general, non-scientist reader—with the actual recordings of the late, great physicist delivering the lectures on which the chapters are based. Nobel Laureate Feynman gave these lectures just once, to a group of Caltech undergraduates in 1961 and 1962, and these newly released recordings allow you to experience one of the Twentieth Century's greatest minds—as if you were right there in the classroom.",1
2025-03-18 16:28:22,https://www.goodreads.com/book/show/11337189-a-universe-from-nothing,A Universe from Nothing: Why There Is Something Rather Than Nothing,Lawrence M. Krauss,3.94,"30,056","Science, Nonfiction, Physics","Bestselling author and acclaimed physicist Lawrence Krauss offers a paradigm-shifting view of how everything that exists came to be in the first place.

“Where did the universe come from? What was there before it? What will the future bring? And finally, why is there something rather than nothing?”

One of the few prominent scientists today to have crossed the chasm between science and popular culture, Krauss describes the staggeringly beautiful experimental observations and mind-bending new theories that demonstrate not only can something arise from nothing, something will always arise from nothing. With a new preface about the significance of the discovery of the Higgs particle, A Universe from Nothing uses Krauss’s characteristic wry humor and wonderfully clear explanations to take us back to the beginning of the beginning, presenting the most recent evidence for how our universe evolved—and the implications for how it’s going to end.

Provocative, challenging, and delightfully readable, this is a game-changing look at the most basic underpinning of existence and a powerful antidote to outmoded philosophical, religious, and scientific thinking.",1
2025-03-18 16:28:34,https://www.goodreads.com/book/show/1662160.Your_Inner_Fish,Your Inner Fish: a Journey into the 3.5-Billion-Year History of the Human Body,Neil Shubin,4.04,"27,563","Science, Nonfiction, Biology","Why do we look the way we do? What does the human hand have in common with the wing of a fly? Are breasts, sweat glands, and scales connected in some way? To better understand the inner workings of our bodies and to trace the origins of many of today's most common diseases, we have to turn to unexpected sources: worms, flies, and even fish.

Neil Shubin, a leading paleontologist and professor of anatomy who discovered Tiktaalik-the ""missing link"" that made headlines around the world in April 2006-tells the story of evolution by tracing the organs of the human body back millions of years, long before the first creatures walked the earth. By examining fossils and DNA, Shubin shows us that our hands actually resemble fish fins, our head is organized like that of a long-extinct jawless fish, and major parts of our genome look and function like those of worms and bacteria.

Shubin makes us see ourselves and our world in a completely new light. Your Inner Fish is science writing at its finest-enlightening, accessible, and told with irresistible enthusiasm.",1
2025-03-18 16:28:53,https://www.goodreads.com/book/show/16213.The_Hot_Zone,The Hot Zone: The Terrifying True Story of the Origins of the Ebola Virus,Richard Preston,4.16,"118,018","Nonfiction, Science, History","A highly infectious, deadly virus from the central African rain forest suddenly appears in the suburbs of Washington, D.C. There is no cure. In a few days 90 percent of its victims are dead. A secret military SWAT team of soldiers and scientists is mobilized to stop the outbreak of this exotic ""hot"" virus. The Hot Zone tells this dramatic story, giving a hair-raising account of the appearance of rare and lethal viruses and their ""crashes"" into the human race. Shocking, frightening, and impossible to ignore, The Hot Zone proves that truth really is scarier than fiction.",1
2025-03-18 16:29:12,https://www.goodreads.com/book/show/5981308-bonk,Bonk: The Curious Coupling of Science and Sex,Mary Roach,3.85,"59,215","Nonfiction, Science, Humor","In Bonk, the best-selling author of Stiff turns her outrageous curiosity and insight on the most alluring scientific subject of all: sex. Can a person think herself to orgasm? Why doesn't Viagra help women-or, for that matter, pandas? Can a dead man get an erection? Is vaginal orgasm a myth? Mary Roach shows us how and why sexual arousal and orgasm-two of the most complex, delightful, and amazing scientific phenomena on earth-can be so hard to achieve and what science is doing to make the bedroom a more satisfying place.",1
2025-03-18 16:29:30,https://www.goodreads.com/book/show/4806.Longitude,Longitude: The True Story of a Lone Genius Who Solved the Greatest Scientific Problem of His Time,Dava Sobel,3.99,"74,026","History, Nonfiction, Science","Longitude is the dramatic human story of an epic scientific quest. The ""longitude problem"" was the thorniest dilemma of the eighteenth century. Lacking the ability to measure longitude, sailors throughout the great ages of exploration had been literally lost at sea.

At the heart of Dava Sobel's fascinating brief history of astronomy, navigation and horology stands the figure of John Harrison, self-taught Yorkshire clockmaker, and his forty-year obsession with building the perfect timekeeper. Battling against the establishment, Harrison stood alone in pursuit of his solution and the £20,000 reward offered by Parliament.",2
2025-03-18 16:29:43,https://www.goodreads.com/book/show/25733983-lab-girl,Lab Girl,Hope Jahren,3.98,"70,060","Nonfiction, Science, Memoir","Acclaimed scientist Hope Jahren has built three laboratories in which she’s studied trees, flowers, seeds, and soil. Her first book is a revelatory treatise on plant life—but it is also so much more.

Lab Girl is a book about work, love, and the mountains that can be moved when those two things come together. It is told through Jahren’s stories: about her childhood in rural Minnesota with an uncompromising mother and a father who encouraged hours of play in his classroom’s labs; about how she found a sanctuary in science, and learned to perform lab work done “with both the heart and the hands”; and about the inevitable disappointments, but also the triumphs and exhilarating discoveries, of scientific work.

Yet at the core of this book is the story of a relationship Jahren forged with a brilliant, wounded man named Bill, who becomes her lab partner and best friend. Their sometimes rogue adventures in science take them from the Midwest across the United States and back again, over the Atlantic to the ever-light skies of the North Pole and to tropical Hawaii, where she and her lab currently make their home.",2
2025-03-18 16:30:02,https://www.goodreads.com/book/show/17465709-braiding-sweetgrass,"Braiding Sweetgrass: Indigenous Wisdom, Scientific Knowledge, and the Teachings of Plants",Robin Wall Kimmerer,4.52,"147,759","Nonfiction, Science, Audiobook","As a botanist, Robin Wall Kimmerer has been trained to ask questions of nature with the tools of science. As a member of the Citizen Potawatomi Nation, she embraces the notion that plants and animals are our oldest teachers. In Braiding Sweetgrass, Kimmerer brings these lenses of knowledge together to show that the awakening of a wider ecological consciousness requires the acknowledgment and celebration of our reciprocal relationship with the rest of the living world. For only when we can hear the languages of other beings are we capable of understanding the generosity of the earth, and learning to give our own gifts in return.",2
2025-03-18 16:30:13,https://www.goodreads.com/book/show/17977.The_Ancestor_s_Tale,The Ancestor's Tale: A Pilgrimage to the Dawn of Evolution,Richard Dawkins,4.14,"28,230","Science, Nonfiction, Biology","The renowned biologist and thinker Richard Dawkins presents his most expansive work yet: a comprehensive look at evolution, ranging from the latest developments in the field to his own provocative views. Loosely based on the form of Chaucer's Canterbury Tales, Dawkins's Tale takes us modern humans back through four billion years of life on our planet. As the pilgrimage progresses, we join with other organisms at the forty ""rendezvous points"" where we find a common ancestor. The band of pilgrims swells into a vast crowd as we join first with other primates, then with other mammals, and so on back to the first primordial organism.

Dawkins's brilliant, inventive approach allows us to view the connections between ourselves and all other life in a bracingly novel way. It also lets him shed bright new light on the most compelling aspects of evolutionary history and theory: sexual selection, speciation, convergent evolution, extinction, genetics, plate tectonics, geographical dispersal, and more. The Ancestor's Tale is at once a far-reaching survey of the latest, best thinking on biology and a fascinating history of life on Earth. Here Dawkins shows us how remarkable we are, how astonishing our history, and how intimate our relationship with the rest of the living world.",2
2025-03-18 16:30:25,https://www.goodreads.com/book/show/15852.Relativity,Relativity: The Special and the General Theory,Albert Einstein,4.20,"22,419","Science, Physics, Nonfiction","An accesible version of Einstein's masterpiece of theory, written by the genius himself

According to Einstein himself, this book is intended ""to give an exact insight into the theory of Relativity to those readers who, from a general scientific and philosophical point of view, are interested in the theory, but who are not conversant with the mathematical apparatus of theoretical physics."" When he wrote the book in 1916, Einstein's name was scarcely known outside the physics institutes. Having just completed his masterpiece, The General Theory of Relativity—which provided a brand-new theory of gravity and promised a new perspective on the cosmos as a whole—he set out at once to share his excitement with as wide a public as possible in this popular and accessible book.

Here published for the first time as a Penguin Classic, this edition of Relativity features a new introduction by bestselling science author Nigel Calder.",2
2025-03-18 16:30:36,https://www.goodreads.com/book/show/27333.Silent_Spring,Silent Spring,Rachel Carson,4.05,"51,810","Nonfiction, Science, Environment","Silent Spring is an environmental science book. The book documents the adverse environmental effects caused by the indiscriminate use of pesticides. Carson accused the chemical industry of spreading disinformation, and public officials of accepting the industry's marketing claims unquestioningly.

The book appeared in September 1962 and the outcry that followed its publication forced the banning of DDT and spurred revolutionary changes in the laws affecting our air, land, and water. Carson’s book was instrumental in launching the environmental movement.",2
2025-03-18 16:30:47,https://www.goodreads.com/book/show/18377999-gulp,Gulp: Adventures on the Alimentary Canal,Mary Roach,3.93,"49,990","Nonfiction, Science, Audiobook","“America’s funniest science writer” (Washington Post) takes us down the hatch on an unforgettable tour. The alimentary canal is classic Mary Roach terrain: the questions explored in Gulp are as taboo, in their way, as the cadavers in Stiff and every bit as surreal as the universe of zero gravity explored in Packing for Mars. Why is crunchy food so appealing? Why is it so hard to find words for flavors and smells? Why doesn’t the stomach digest itself? How much can you eat before your stomach bursts? Can constipation kill you? Did it kill Elvis? In Gulp we meet scientists who tackle the questions no one else thinks of—or has the courage to ask. We go on location to a pet-food taste-test lab, a fecal transplant, and into a live stomach to observe the fate of a meal. With Roach at our side, we travel the world, meeting murderers and mad scientists, Eskimos and exorcists (who have occasionally administered holy water rectally), rabbis and terrorists—who, it turns out, for practical reasons do not conceal bombs in their digestive tracts.
Like all of Roach’s books, Gulp is as much about human beings as it is about human bodies.",2
2025-03-18 16:30:58,https://www.goodreads.com/book/show/2094.A_Briefer_History_of_Time,A Briefer History of Time,Stephen Hawking,4.26,"41,449","Science, Nonfiction, Physics","Stephen Hawking's worldwide bestseller, A Brief History of Time, has been a landmark volume in scientific writing. Its author's engaging voice is one reason, and the compelling subjects he addresses is another; the nature of space and time, the role of God in creation, the history and future of the universe. But it is also true that in the years since its publication, readers have repeatedly told Professor Hawking of their great difficulty in understanding some of the book's most important concepts.

This is the origin of and the reason for A Briefer History of Time: its author's wish to make its content more accessible to readers - as well as to bring it up-to-date with the latest scientific observations and findings.

Although this book is literally somewhat ""briefer"", it actually expands on the great subjects of the original. Purely technical concepts, such as the mathematics of chaotic boundary conditions, are gone. Conversely, subjects of wide interest that were difficult to follow because they were interspersed throughout the book have now been given entire chapters of their own, including relativity, curved space, and quantum theory.

This reorganization has allowed the authors to expand areas of special interest and recent progress, from the latest developments in string theory to exciting developments in the search for a complete unified theory of all the forces of physics. Like prior editions of the book - but even more so - A Briefer History of Time will guide nonscientists everywhere in the ongoing search for the tantalizing secrets at the heart of time and space.

Thirty-seven full-color illustrations enhance the text and make A Briefer History of Time an exhilarating addition in its own right to the literature of science.",2
2025-03-18 16:31:09,https://www.goodreads.com/book/show/36613747-how-to-change-your-mind,How to Change Your Mind: The New Science of Psychedelics,Michael Pollan,4.27,"80,953","Nonfiction, Science, Psychology","Could psychedelic drugs change our worldview? One of America's most admired writers takes us on a mind-altering journey to the frontiers of human consciousness

When LSD was first discovered in the 1940s, it seemed to researchers, scientists and doctors as if the world might be on the cusp of psychological revolution. It promised to shed light on the deep mysteries of consciousness, as well as offer relief to addicts and the mentally ill. But in the 1960s, with the vicious backlash against the counter-culture, all further research was banned. In recent years, however, work has quietly begun again on the amazing potential of LSD, psilocybin and DMT. Could these drugs in fact improve the lives of many people? Diving deep into this extraordinary world and putting himself forward as a guinea-pig, Michael Pollan has written a remarkable history of psychedelics and a compelling portrait of the new generation of scientists fascinated by the implications of these drugs. How to Change Your Mind is a report from what could very well be the future of human consciousness.",2
